{
  "schema_version": 1,
  "record_id": "daily-2026-10-13-daily-design",
  "topic_id": "daily-design",
  "date": "2026-10-13",
  "timezone": "Asia/Shanghai",
  "title": "每日记忆方案",
  "summary": "确认年/月/日逐层读取",
  "details": "尚未实施",
  "source_refs": [],
  "work_ref": null,
  "occurred_at": "2026-10-13T08:00:00Z",
  "revision": 0,
  "updated_at": "2026-10-13T08:00:00Z",
  "updated_by": "xiao-tao/test",
  "request_id": "turn-1",
  "request_hash": "aaaaaaaaaaaaaaaaaaaaaaaaaaaaaaaaaaaaaaaaaaaaaaaaaaaaaaaaaaaaaaaa"
}
